<?xml version="1.0"?>
<!--
/**
 * Magento
 *
 * NOTICE OF LICENSE
 *
 * This source file is subject to the Academic Free License (AFL 3.0)
 * that is bundled with this package in the file LICENSE_AFL.txt.
 * It is also available through the world-wide-web at this URL:
 * http://opensource.org/licenses/afl-3.0.php
 * If you did not receive a copy of the license and are unable to
 * obtain it through the world-wide-web, please send an email
 * to license@magentocommerce.com so we can send you a copy immediately.
 *
 * DISCLAIMER
 *
 * Do not edit or add to this file if you wish to upgrade Magento to newer
 * versions in the future. If you wish to customize Magento for your
 * needs please refer to http://www.magentocommerce.com for more information.
 *
 * @copyright   Copyright (c) 2014 X.commerce, Inc. (http://www.magentocommerce.com)
 * @license     http://opensource.org/licenses/afl-3.0.php  Academic Free License (AFL 3.0)
 */
-->
<config xmlns:xsi="http://www.w3.org/2001/XMLSchema-instance" xsi:noNamespaceSchemaLocation="../../../../../lib/internal/Magento/Framework/Module/etc/module.xsd">
    <module name="Magento_Reports" schema_version="1.6.0.0.2" active="true">
        <sequence>
            <module name="Magento_Customer"/>
            <module name="Magento_Catalog"/>
            <module name="Magento_Sales"/>
            <module name="Magento_Cms"/>
        </sequence>
        <depends>
            <module name="Magento_Store"/>
            <module name="Magento_Eav"/>
            <module name="Magento_Customer"/>
            <module name="Magento_Catalog"/>
            <module name="Magento_Sales"/>
            <module name="Magento_Cms"/>
            <module name="Magento_Backend"/>
            <module name="Magento_Core"/>
            <module name="Magento_Widget"/>
            <module name="Magento_Log"/>
            <module name="Magento_Wishlist"/>
            <module name="Magento_Review"/>
            <module name="Magento_CatalogInventory"/>
            <module name="Magento_Tax"/>
            <module name="Magento_Downloadable"/>
            <module name="Magento_SalesRule"/>
        </depends>
    </module>
</config>
